{
  "id": "GEN-L01",
  "title": "Molecular foundations",
  "description": "A short retrieval session across structure, bonding, and biochemical building blocks.",
  "subject": "General chemistry",
  "chapter": "Foundations",
  "version": "1.0.0",
  "totalPoints": 13,
  "selection": { "mode": "fixed" },
  "questions": [
    {
      "id": "q001",
      "type": "single-choice",
      "question": "Which subatomic particle primarily determines an element's chemical identity?",
      "options": [
        { "id": "A", "text": "Neutron" },
        { "id": "B", "text": "Electron" },
        { "id": "C", "text": "Proton" },
        { "id": "D", "text": "Photon" }
      ],
      "answer": "C",
      "points": 2,
      "explanation": "The atomic number is the number of protons in the nucleus, and it defines which element an atom is.",
      "difficulty": "easy",
      "tags": ["atomic structure", "periodic table"]
    },
    {
      "id": "q002",
      "type": "single-choice",
      "question": "In a water molecule, the bond between oxygen and hydrogen is best described as…",
      "options": [
        { "id": "A", "text": "Non-polar covalent" },
        { "id": "B", "text": "Polar covalent" },
        { "id": "C", "text": "Ionic" },
        { "id": "D", "text": "Metallic" }
      ],
      "answer": "B",
      "points": 2,
      "explanation": "Oxygen attracts the shared electrons more strongly than hydrogen, creating a polar covalent bond.",
      "difficulty": "easy",
      "tags": ["chemical bonding", "polarity"]
    },
    {
      "id": "q003",
      "type": "multiple-choice",
      "question": "Which observations are consistent with a polar molecule? Select all that apply.",
      "options": [
        { "id": "A", "text": "It has an uneven distribution of charge." },
        { "id": "B", "text": "It can interact with other dipoles." },
        { "id": "C", "text": "Its bond electrons are always shared equally." },
        { "id": "D", "text": "Its geometry can prevent bond dipoles from cancelling." }
      ],
      "answers": ["A", "B", "D"],
      "points": 3,
      "explanation": "A polar molecule has a net dipole. Uneven charge distribution, dipole interactions, and non-cancelling bond dipoles are all clues.",
      "difficulty": "medium",
      "tags": ["molecular polarity", "geometry"]
    },
    {
      "id": "q004",
      "type": "true-false",
      "question": "A catalyst changes the equilibrium constant of the reaction it catalyses.",
      "answer": false,
      "points": 1,
      "explanation": "A catalyst lowers the activation energy for both forward and reverse reactions. It changes the rate, not the equilibrium constant.",
      "difficulty": "medium",
      "tags": ["kinetics", "equilibrium"]
    },
    {
      "id": "q005",
      "type": "true-false",
      "question": "The pH of a neutral solution at 25 °C is 7.",
      "answer": true,
      "points": 1,
      "explanation": "At 25 °C, neutral water has equal concentrations of H₃O⁺ and OH⁻, giving pH 7.",
      "difficulty": "easy",
      "tags": ["acids and bases", "pH"]
    },
    {
      "id": "q006",
      "type": "fill-in-the-blank",
      "question": "What is the name of the functional group written as –OH?",
      "answer": "hydroxyl",
      "acceptableAnswers": ["hydroxy group"],
      "grading": { "caseSensitive": false, "collapseWhitespace": true },
      "points": 2,
      "explanation": "The –OH group is called a hydroxyl group. It is characteristic of alcohols and appears in many biomolecules.",
      "difficulty": "easy",
      "tags": ["functional groups", "organic chemistry"]
    },
    {
      "id": "q007",
      "type": "fill-in-the-blank",
      "question": "Complete the notation for the common phosphate ion: PO₄____⁻.",
      "answer": "3",
      "acceptableAnswers": ["³", "3-"],
      "grading": { "caseSensitive": false, "collapseWhitespace": true },
      "points": 2,
      "explanation": "The phosphate ion is PO₄³⁻, carrying an overall charge of −3.",
      "difficulty": "medium",
      "tags": ["ions", "biochemistry"]
    }
  ]
}
