{
  "id": "PCHEM-L01",
  "title": "物理化学绪论：数学基础与理想气体",
  "description": "练习物理化学的研究范围、全微分、理想气体方程、经验气体定律与分压。",
  "subject": "Physical Chemistry",
  "chapter": "Chapter 1 · Introduction and perfect gases",
  "version": "1.0.0",
  "totalPoints": 16,
  "selection": { "mode": "fixed" },
  "questions": [
    { "id": "q001", "type": "single-choice", "question": "物理化学的核心任务更接近于……", "options": [{ "id": "A", "text": "只记录物质的颜色和气味" }, { "id": "B", "text": "用物理原理和数学模型解释、预测化学体系的性质与行为" }, { "id": "C", "text": "只研究元素的命名" }, { "id": "D", "text": "只研究有机反应机理" }], "answer": "B", "points": 1, "explanation": "物理化学连接宏观可测量量与微观结构、运动及反应路径，强调模型、测量和预测。", "difficulty": "easy", "tags": ["scope", "physical chemistry"] },
    { "id": "q002", "type": "multiple-choice", "question": "关于物理化学分支，下列哪些配对正确？", "options": [{ "id": "A", "text": "热力学——状态性质、平衡与过程方向" }, { "id": "B", "text": "化学动力学——反应速率、机理与催化" }, { "id": "C", "text": "统计力学——由微观统计行为联系宏观性质" }, { "id": "D", "text": "量子化学——只研究容器的宏观体积" }], "answers": ["A", "B", "C"], "points": 1, "explanation": "A、B、C 分别对应课程中对热力学、动力学和统计力学的分工；量子化学关注原子、化学键和光谱等量子描述。", "difficulty": "easy", "tags": ["thermodynamics", "kinetics", "statistical mechanics"] },
    { "id": "q003", "type": "single-choice", "question": "若 z=f(x,y)，其全微分应写为……", "options": [{ "id": "A", "text": "dz=(∂z/∂x)ᵧdx+(∂z/∂y)ₓdy" }, { "id": "B", "text": "dz=dx+dy，与 z 无关" }, { "id": "C", "text": "dz=(∂x/∂z)dy" }, { "id": "D", "text": "dz=xdy−ydx" }], "answer": "A", "points": 1, "explanation": "多元函数的全微分由各独立变量方向的偏导贡献组成，下标标明求偏导时保持不变的变量。", "difficulty": "easy", "tags": ["total differential", "mathematical preparation"] },
    { "id": "q004", "type": "single-choice", "question": "欧拉循环关系的乘积形式是……", "options": [{ "id": "A", "text": "(∂y/∂x)z(∂x/∂z)y(∂z/∂y)x=−1" }, { "id": "B", "text": "(∂y/∂x)z(∂x/∂z)y(∂z/∂y)x=0" }, { "id": "C", "text": "三个偏导之和必为 1" }, { "id": "D", "text": "只适用于单变量函数" }], "answer": "A", "points": 1, "explanation": "当三个变量相互受约束时，循环偏导的乘积为 −1，这是热力学变量变换中的常用关系。", "difficulty": "medium", "tags": ["Euler relation", "partial derivatives"] },
    { "id": "q005", "type": "single-choice", "question": "理想气体状态方程是……", "options": [{ "id": "A", "text": "pV=nRT" }, { "id": "B", "text": "pV=RT/n" }, { "id": "C", "text": "p+V=nRT" }, { "id": "D", "text": "pT=nRV" }], "answer": "A", "points": 1, "explanation": "理想气体状态方程为 pV=nRT，其中 p、V、T、n 分别为压力、体积、热力学温度和物质的量。", "difficulty": "easy", "tags": ["ideal gas", "equation of state"] },
    { "id": "q006", "type": "single-choice", "question": "代入理想气体方程时，温度必须使用……", "options": [{ "id": "A", "text": "摄氏温度 °C" }, { "id": "B", "text": "华氏温度 °F" }, { "id": "C", "text": "热力学温度 K" }, { "id": "D", "text": "任意温标，不需要换算" }], "answer": "C", "points": 1, "explanation": "理想气体方程中的温度是绝对温度，必须使用 K；同时压力和体积单位要与 R 的单位匹配。", "difficulty": "easy", "tags": ["ideal gas", "units"] },
    { "id": "q007", "type": "true-false", "question": "真实气体在低压极限 p→0 时通常趋近理想气体行为。", "answer": true, "points": 1, "explanation": "低压下分子间平均距离增大，分子自身大小和相互作用的相对影响减小，因此真实气体趋近理想行为。", "difficulty": "easy", "tags": ["real gas", "ideal gas"] },
    { "id": "q008", "type": "single-choice", "question": "Boyle 定律适用于哪组恒定条件？", "options": [{ "id": "A", "text": "n、T 恒定，pV 恒定" }, { "id": "B", "text": "p、T 恒定，V/n 恒定" }, { "id": "C", "text": "n、V 恒定，p/T 恒定" }, { "id": "D", "text": "所有变量都可任意变化" }], "answer": "A", "points": 1, "explanation": "Boyle 定律描述恒温、定量气体的压力与体积反比，即 pV 为常数。", "difficulty": "easy", "tags": ["Boyle law", "gas laws"] },
    { "id": "q009", "type": "single-choice", "question": "Avogadro 原理指出，在 p、T 恒定时……", "options": [{ "id": "A", "text": "V/n 为常数" }, { "id": "B", "text": "pV 为常数" }, { "id": "C", "text": "p/T 为常数" }, { "id": "D", "text": "V/T 为常数且 n 必须变化" }], "answer": "A", "points": 1, "explanation": "在恒压恒温下，气体体积与物质的量成正比，因此 V/n 为常数。", "difficulty": "easy", "tags": ["Avogadro principle", "gas laws"] },
    { "id": "q010", "type": "single-choice", "question": "同一气体在两个状态之间的组合气体定律可写为……", "options": [{ "id": "A", "text": "p₁V₁/(n₁T₁)=p₂V₂/(n₂T₂)" }, { "id": "B", "text": "p₁V₁n₁T₁=p₂V₂n₂T₂" }, { "id": "C", "text": "p₁/T₁=p₂/V₂" }, { "id": "D", "text": "p₁V₁=p₂V₂，无论 n、T 如何变化" }], "answer": "A", "points": 1, "explanation": "将 pV=nRT 应用于两个状态即可得到该关系；若 n 不变，可进一步约去 n。", "difficulty": "medium", "tags": ["combined gas law", "state variables"] },
    { "id": "q011", "type": "single-choice", "question": "组分 J 的摩尔分数定义是……", "options": [{ "id": "A", "text": "xⱼ=nⱼ/n_total" }, { "id": "B", "text": "xⱼ=pⱼ/p，只在所有体系中成立" }, { "id": "C", "text": "xⱼ=V_total/Vⱼ" }, { "id": "D", "text": "xⱼ=Tⱼ/T_total" }], "answer": "A", "points": 1, "explanation": "摩尔分数的定义是该组分物质的量除以总物质的量；对理想气体混合物还可等于分压与总压之比。", "difficulty": "easy", "tags": ["mole fraction", "gas mixtures"] },
    { "id": "q012", "type": "single-choice", "question": "Dalton 分压定律对理想气体混合物给出……", "options": [{ "id": "A", "text": "p=Σpⱼ" }, { "id": "B", "text": "p=Πpⱼ" }, { "id": "C", "text": "p=Σxⱼ/T" }, { "id": "D", "text": "p 与各组分无关" }], "answer": "A", "points": 1, "explanation": "理想气体混合物的总压等于各组分分压之和。", "difficulty": "easy", "tags": ["Dalton law", "partial pressure"] },
    { "id": "q013", "type": "true-false", "question": "在任何气体混合物中，摩尔分数都可以直接写成分压除以总压。", "answer": false, "points": 1, "explanation": "xⱼ=pⱼ/p 需要理想气体混合物这一条件；摩尔分数本身的普遍定义始终是 nⱼ/n_total。", "difficulty": "medium", "tags": ["mole fraction", "partial pressure"] },
    { "id": "q014", "type": "multiple-choice", "question": "使用 pV=nRT 时，哪些做法是必要的？", "options": [{ "id": "A", "text": "温度换成 K" }, { "id": "B", "text": "压力单位与 R 匹配" }, { "id": "C", "text": "体积单位与 R 匹配" }, { "id": "D", "text": "把摄氏温度直接代入也没有影响" }], "answers": ["A", "B", "C"], "points": 1, "explanation": "单位一致是状态方程正确计算的前提，尤其要避免直接代入摄氏温度。", "difficulty": "medium", "tags": ["units", "equation of state"] },
    { "id": "q015", "type": "single-choice", "question": "某理想气体从 p₁=100 kPa、V₁=2.0 L、T₁=300 K 变为 V₂=1.0 L、T₂=450 K，物质的量不变，则 p₂ 为多少？", "options": [{ "id": "A", "text": "67 kPa" }, { "id": "B", "text": "150 kPa" }, { "id": "C", "text": "300 kPa" }, { "id": "D", "text": "600 kPa" }], "answer": "C", "points": 2, "explanation": "定量气体满足 p₁V₁/T₁=p₂V₂/T₂，因此 p₂=100×2.0×450/(300×1.0)=300 kPa。", "difficulty": "hard", "tags": ["extension", "combined gas law", "calculation"] }
  ]
}
